{
  "role": "critic",
  "position": "revise",
  "confidence": 0.78,
  "summary": "Для соло-MVP с ПДн на одном VPS «остаться на SQLite потому что нагрузка мала» — опасно упрощённый аргумент. Нагрузка здесь не главный драйвер; решают резервное копирование, шифрование, контроль доступа и план восстановления после сбоя. SQLite технически выдержит автора и тестеров, но ПДн снимают право на «файл на диске без процедур». Миграционные и типовые боли SQLite при ПДн — не косметика: ошибка схемы или откат без бэкапа бьёт по людям, а не по демо-данным. PostgreSQL на том же VPS добавляет операционный налог, но даёт привычные инструменты (роли, pg_dump, PITR позже). Вердикт критика: не «сразу Postgres ради масштаба», а «SQLite допустим только с явным PII-пакетом; иначе — перейти сейчас или не хранить ПДн в MVP».",
  "key_points": [
    "ПДн меняют критерий выбора: не RPS, а «что случится при утечке/потере файла БД и кто ответит» — без ответа любой выбор БД преждевременен.",
    "«Мелкие неудобства» миграций и типов при SQLite с ПДн недооценены: ALTER TABLE, откат миграции и рассинхрон ORM/схемы на проде с реальными пользователями дороже, чем на демо.",
    "Один VPS — единая точка отказа; SQLite (один файл) усиливает риск «rm -rf / потеря всего»; Postgres не спасает от VPS, но упрощает отдельные бэкапы и восстановление, если настроить с первого дня.",
    "«Возможно скоро» масштабирование без порогов — ловушка отложенного решения: миграция SQLite→Postgres под живыми ПДн болезненнее, чем поднять Postgres на MVP с pg_dump-ритуалом.",
    "Соло-разработчик не освобождён от минимального compliance-пакета (шифрование диска/VPS, секреты вне репо, политика удаления, логирование доступа) — выбор БД вторичен относительно этих обязательств."
  ],
  "risks": [
    "Хранение файла SQLite с ПДн на VPS без автоматических off-site бэкапов и проверенного restore — высокая вероятность необратимой потери или простоя при одном инциденте.",
    "Откладывание перехода на Postgres «пока мало пользователей» при уже накопленных ПДн: стоимость миграции и даунтайм растут нелинейно, а окно для тестового cutover сужается.",
    "Ложное чувство безопасности от «Postgres = безопасно»: поднятый на том же VPS без TLS, ролей, патчей и мониторинга Postgres не закрывает PII-риски — только переносит их в другой сервис."
  ],
  "evidence": [
    "assumptions.yaml: facts — «Данные: персональные данные пользователей (ПДн)», «Хостинг: один VPS/VM», team_size: 1",
    "intake/answers.yaml: data_sensitivity: «Персональные данные пользователей», sqlite_pain: «Мелкие неудобства (миграции, типы)»",
    "BRIEF.md: success criteria требуют порогов «когда пора» и оценки стоимости перехода для соло — без них решение о SQLite vs Postgres не falsifiable",
    "SQLite: один writer при WAL — достаточно для «только я и тестеры» (assumptions.yaml), но не снимает требований к backup/encryption для ПДн",
    "unknown: юрисдикция и класс ПДн (GDPR/152-ФЗ), наличие шифрования at-rest на VPS, текущий стек (Node/Python/Go) — влияет на оценку стоимости миграции"
  ],
  "questions_for_others": [
    "Security/Cybersec: какой минимальный PII-пакет (бэкапы, шифрование, ротация секретов) вы считаете обязательным независимо от SQLite vs Postgres на одном VPS?",
    "Lawyer: при заявленных ПДн какие обязательства (уведомление, срок хранения, право на удаление) должны быть заложены в схему данных уже на MVP?",
    "Pragmatist: реалистичная оценка часов соло на «Postgres на том же VPS + ежедневный pg_dump off-site» vs «SQLite + Litestream/аналог» — что дешевле при том же уровне recoverability?",
    "Architect: есть ли в домене сценарии concurrent write или full-text/geo, которые сделают SQLite bottleneck раньше заявленного «возможно скоро»?"
  ],
  "recommendation": "Принять решение в два шага: (1) зафиксировать PII-минимум — off-site бэкапы с ежемесячным тестом restore, шифрование тома/секретов, политика удаления пользователя; (2) если этот пакет на SQLite реализуется за ≤1–2 дня соло — остаться на SQLite до явных триггеров (>3 одновременных writer-потоков, need row-level security/replication, или миграции стали еженедельной болью); иначе перейти на PostgreSQL на том же VPS с первого релиза с ПДн, не дожидаясь «масштаба». Не хранить ПДн в MVP без одного из двух путей."
}
