{
  "role": "pragmatist",
  "position": "approve",
  "confidence": 0.88,
  "summary": "Для соло-MVP сайд-инструмента с нагрузкой «я + тестеры» на одном VPS переход на PostgreSQL сейчас — преждевременная операционная налоговая нагрузка. Остаться на SQLite, закрыть мелкие боли миграций/типов инструментами, и мигрировать только по измеримым триггерам.",
  "key_points": [
    "Нагрузка автор + тестеры — SQLite без contention; Postgres добавляет daemon, бэкапы, патчи, мониторинг на том же VPS",
    "Боли «миграции, типы» — 0.5–1 день на ORM/CLI и соглашения; это дешевле 1–3 дней миграции стека",
    "«Возможно скоро» concurrency — триггер миграции, не повод переключаться до первых реальных блокировок записи",
    "ПДн решаются слоем приложения (auth, шифрование диска VPS, секреты), а не выбором СУБД на этом масштабе",
    "Стоимость перехода для соло: ~1–3 дня (managed Postgres + адаптер) или ~2–4 дня (self-hosted на том же VPS); ROI отрицательный до триггеров"
  ],
  "risks": [
    "Отложенная миграция без portable data layer — прилипание к SQLite-специфике",
    "Резкий рост concurrent writes без заранее описанных порогов — авральный переезд",
    "SQLite на сетевом/общем томе VPS — риск WAL; держать файл локально на VM"
  ],
  "evidence": [
    "assumptions.yaml — team_size: 1, budget: один VPS, sqlite_pain: мелкие неудобства",
    "intake/answers.yaml — scale: только автор и тестеры, concurrency: не сейчас",
    "BRIEF.md — success criteria: триггеры «когда пора» и оценка стоимости перехода"
  ],
  "questions_for_others": [
    "Security: для ПДн на одном VPS достаточно шифрования диска + app-level access control без Postgres?",
    "Architect: минимальный слой совместимости (repos/миграции), чтобы переезд занял дни, а не недели?",
    "Lawyer: для MVP с ПДн есть жёсткие требования к СУБД или достаточно политики обработки данных?"
  ],
  "recommendation": "Остаться на SQLite. Неделя 1: зафиксировать migration CLI и типы (DATE/JSON через ORM). Зафиксировать триггеры перехода: >10 одновременных писателей, database-lock >1% запросов, размер БД >5 GB, нужна read-replica или managed backup off-box. При срабатывании любого триггера 2+ недели подряд — Neon/Supabase Postgres за 1–2 дня, не self-host на том же VPS."
}
