{
  "role": "lawyer",
  "position": "approve",
  "confidence": 0.78,
  "summary": "152-ФЗ не диктует движок БД — важны место хранения, меры защиты и цепочка обработчиков. Для соло-MVP с ПДн на одном VPS в РФ SQLite или self-hosted PostgreSQL на том же сервере юридически проще: меньше субобработчиков, проще доказать локализацию. Managed PostgreSQL за рубежом или с бэкапами вне РФ — зона «revise» до договора поручения и проверки локализации. Выбор БД не снимает обязанностей оператора: политика, основания обработки, учёт обращений субъектов, реагирование на инциденты.",
  "key_points": [
    "152-ФЗ (ст. 18): первичная запись, хранение, уточнение и извлечение ПДн граждан РФ — на серверах в РФ; SQLite-файл и self-hosted PG на российском VPS укладываются при условии, что провайдер и диски физически в РФ",
    "Тип СУБД не влияет на статус оператора: нужны политика обработки, правовое основание (согласие/договор), минимизация состава ПДн, журнал обращений субъектов — одинаково для SQLite и PostgreSQL",
    "SQLite на том же VPS: одна юридическая «точка» хранения, нет отдельного поручения обработчику БД — для соло с минимальным бюджетом это типовая практика снижения compliance-накладных расходов",
    "Self-hosted PostgreSQL на том же VPS: с точки зрения 152-ФЗ эквивалентен SQLite при тех же мерах защиты; миграция не меняет обязанности, меняет только поверхность администрирования",
    "Managed PostgreSQL (Supabase, Neon, Railway, AWS RDS и т.п.): появляется обработчик по ст. 6 152-ФЗ — нужен договор поручения/обработки, реестр субобработчиков, проверка что primary и реплики в РФ; зарубежный регион без локализации — высокий регуляторный риск",
    "Российские managed-сервисы (Yandex Cloud, Selectel, VK Cloud и аналоги): формально допустимы при договоре с пунктами о ПДн, указании локации и SLA; для MVP соло часто избыточны по стоимости и бумаге относительно файла/SQLite",
    "Резервные копии — это те же ПДн: offsite-бэкап в зарубежный S3/Backblaze без шифрования и без локализации = отдельное нарушение; бэкапы держать в РФ (второй VPS, object storage провайдера с дата-центром в РФ) или на том же хосте с шифрованием at rest",
    "Провайдер VPS — тоже обработчик: в оферте/договоре хостинга должны быть условия о конфиденциальности и (желательно) локализации; при B2B-продукте для пользователей — публичная политика и согласие до регистрации",
    "ИП vs ООО: для MVP с ПДн третьих лиц ИП допустим; при масштабировании и B2B-контрактах клиенты часто требуют ООО и документы по 152-ФЗ — это триггер бизнеса, не БД",
    "Уведомление Роскомnadzor: обязательно до начала обработки, если обработка не подпадает под исключения; для MVP с email/ФИО пользователей — типовая практика подать уведомление (или проверить основание для отказа с живым юристом)"
  ],
  "risks": [
    "Managed PG в EU/US: локализация и трансграничная передача без правового основания — штрафы по ст. 13.11 КоАП и предписания Роскомnadzor",
    "Автобэкапы хостера или snapshot VPS в зарубежный регион — «тихая» копия ПДн вне РФ",
    "Отсутствие договора поручения с хостингом/DBaaS при формальной передаче доступа к ПДн",
    "Утечка SQLite-файла через git, общий бэкап без шифрования — не вопрос выбора БД, но SQLite чаще копируют «как файл» без ACL",
    "Обработка ПДн без политики и согласия при выходе из «только я и тестеры» к публичному MVP"
  ],
  "evidence": [
    "152-ФЗ (ст. 5, 6, 18, 19 — обязанности оператора, поручение обработки, локализация, меры защиты)",
    "assumptions.yaml: ПДн пользователей, один VPS, соло-разработчик",
    "intake/answers.yaml: data_sensitivity = персональные данные пользователей",
    "Постановление Правительства РФ № 1119 (уровни защищённости ПДн) — для MVP с email/логинами обычно УЗ-3/УЗ-4, требует проверки состава ПДн с юристом",
    "Типовая практика: поручение обработки ПДн в договоре с хостингом/облаком (ст. 6 152-ФЗ)"
  ],
  "questions_for_others": [
    "Cybersec: какие меры защиты (шифрование at rest, ACL, audit log) реально обеспечить на SQLite vs self-hosted PG на одном VPS?",
    "Security: куда уходит offsite-бэкап и snapshot VPS — география и шифрование?",
    "Architect: managed PG планируется в RU-регионе или зарубежном SaaS?",
    "Pragmatist: MVP остаётся закрытым для тестеров или публичная регистрация — от этого зависит срок подачи уведомления и текст оферты"
  ],
  "recommendation": "С точки зрения 152-ФЗ для солo-MVP с ПДн на одном VPS в РФ: оставаться на SQLite или поднимать PostgreSQL на том же сервере — оба варианта допустимы; managed PostgreSQL подключать только после проверки локализации в РФ и оформления поручения обработки. Независимо от БД: политика конфиденциальности, согласие/основание обработки, бэкапы только в РФ с шифрованием, договор с VPS-провайдером с пунктами о ПДн, чеклист перед публичным запуском. Переход SQLite→PG по техническим триггерам не ухудшает и не улучшает compliance сам по себе.",
  "research_requests": [
    {
      "query": "152-ФЗ локализация ПДн managed PostgreSQL Yandex Cloud Selectel договор поручения обработки 2024-2026",
      "priority": "optional",
      "reason": "Уточнить актуальную практику Роскомnadzor по DBaaS в РФ для таблицы сравнения в ANSWER"
    }
  ]
}
