{
  "role": "architect",
  "position": "approve",
  "confidence": 0.88,
  "summary": "Для соло MVP на одном VPS с нагрузкой «автор + тестеры» SQLite — правильный слой персистентности: один артефакт деплоя, нулевая операционка БД, достаточная конкурентность при WAL. ПДн и «мелкие боли» миграций/типов не оправдывают немедленный переход на PostgreSQL; они требуют переносимого слоя доступа к данным и явных триггеров смены движка. Архитектурный ответ: остаться на SQLite, спроектировать границу репозитория под смену драйвера, перейти на Postgres только при реальной конкурентной записи или потребности в фичах, которых SQLite не даёт.",
  "key_points": [
    "Нагрузка «1 писатель + несколько читателей» укладывается в SQLite с WAL и короткими транзакциями — отдельный Postgres на том же VPS добавляет ops без выигрыша по конкурентности",
    "ПДн — свойство модели данных и периметра (шифрование диска, бэкапы, минимизация полей, аудит), а не выбор SQLite vs Postgres; оба на одном VPS требуют одинаковых контролов",
    "Мелкие боли миграций и типов лечатся инструментом с двойной целью (Drizzle, Prisma migrate, golang-migrate) и дисциплиной «Postgres-совместимый SQL» — не сменой движка на MVP",
    "Граница персистентности: репозиторий/DAO за интерфейсом, без raw SQL в хендлерах; enum/JSON/UUID — через типы ORM, не sqlite-специфику в домене",
    "Триггеры перехода: устойчивые >3–5 одновременных писателей, need row-level security / реплики / listen-notify, файл БД >10–20 GB или бэкап file-level становится риском, горизонтальное масштабирование app-инстансов",
    "Стоимость перехода для соло: 2–5 дней на pg_dump-совместимую схему + CI + managed Postgres или docker-compose; дешевле, если переносимость заложена с первого спринта, чем экстренная миграция под нагрузкой"
  ],
  "risks": [
    "Отложенный Postgres без абстракции — «big bang» миграция при первом реальном росте",
    "SQLite на VPS без encrypted volume и off-site бэкапа — ПДн под риском независимо от СУБД",
    "Преждевременный Postgres на том же VPS — два процесса, память, патчи, мониторинг; solo тратит время не на продукт",
    "Использование SQLite-специфики (без FK, loose typing) усложнит будущий pg_dump"
  ],
  "evidence": [
    "assumptions.yaml — team_size: 1, hosting: один VPS, scale: автор и тестеры, data: ПДн, sqlite_pain: миграции/типы",
    "BRIEF.md — success criteria: рекомендация с триггерами и оценкой стоимости перехода",
    "intake/answers.yaml — concurrency: не сейчас, возможно скоро",
    "SQLite WAL mode — множественные readers + один writer; типичный паттерн для side-tool MVP",
    "PostgreSQL на том же VPS — отдельный systemd/docker-сервис, ~100–300 MB RAM baseline, патчи и volume backup"
  ],
  "questions_for_others": [
    "Security/Cybersec: минимальный набор контролов ПДн для SQLite-файла на одном VPS (encryption at rest, backup cadence)?",
    "Lawyer: есть ли регуляторный драйвер (152-ФЗ residency, DPA) требующий managed Postgres vs file DB?",
    "Developer: какой стек миграций уже выбран — можно ли держать одну схему для sqlite и postgres?",
    "Tech-lead: горизонт «возможно скоро» — это второй app-инстанс или просто больше пользователей на одном процессе?",
    "Pragmatist: сколько дней MVP теряем на поднятие Postgres vs фикс миграций в SQLite?"
  ],
  "recommendation": "Остаться на SQLite для MVP. Сразу: (1) репозиторий за интерфейсом + миграции с dual-target или Postgres-совместимым SQL, (2) WAL + короткие транзакции, (3) encrypted VPS volume + ежедневный off-site бэкап файла БД, (4) документировать триггеры перехода (конкурентные писатели, RLS/реплики, multi-instance). Переход на managed Postgres — по первому сработавшему триггеру, не по дискомфорту от типов."
}
