{
  "role": "tech-lead",
  "position": "approve",
  "confidence": 0.82,
  "summary": "Для соло-MVP на одном VPS с нагрузкой «автор + тестеры» SQLite — правильный выбор по умолчанию. Боли с миграциями и типами решаются инструментами (Drizzle, Prisma, goose), а не сменой СУБД. ПДн не требуют PostgreSQL сам по себе — нужны бэкапы, шифрование диска и контроль доступа. Переход на PostgreSQL откладываю до конкретных триггеров; заложить абстракцию БД сейчас, чтобы миграция заняла 1–3 дня, а не неделю.",
  "key_points": [
    "Операционная сложность — главный враг соло: SQLite убирает отдельный сервис БД, systemd-юнит, мониторинг реплик и ещё один слой на VPS. Для MVP это выигрыш больше, чем «правильная» архитектура.",
    "Текущая нагрузка (один разработчик и тестеры) на порядки ниже потолка SQLite в WAL-режиме. Конкурентная запись из нескольких процессов — единственный реальный риск, и он пока не актуален.",
    "Мелкие неудобства с миграциями и типами — проблема toolchain, не SQLite: typed ORM + миграционный раннер + CI-прогон миграций на чистой БД. Смена на Postgres эти боли не убирает полностью, только переносит.",
    "ПДн меняют требования к бэкапам, шифрованию at-rest и аудиту доступа — не к выбору SQLite vs Postgres. Оба варианта одинаково зависят от дисциплины на VPS.",
    "Триггеры перехода на PostgreSQL: (1) устойчивые параллельные писатели (>1 процесс/инстанс с записью), (2) горизонтальное масштабирование app-слоёv, (3) размер БД >10 ГБ или сложные аналитические запросы, (4) нужны native JSON-операторы / full-text / pgvector без костылей.",
    "Стоимость перехода для соло при ORM-абстракции: 1–3 рабочих дня (docker-compose Postgres, env-переключение, прогон миграций, smoke-тесты). Без абстракции и с SQLite-специфичным SQL — 3–5 дней. Заложить DATABASE_URL и совместимый SQL сейчас — дешёвая страховка."
  ],
  "risks": [
    "SQLite на VPS без автоматических off-site бэкапов: один сбой диска = потеря ПДн. Риск выше, чем выбор СУБД.",
    "Отложенная миграция под нагрузкой болезненнее, чем заранее подготовленная. Если «возможно скоро» означает <3 месяцев — начать Postgres параллельно в dev/staging.",
    "SQLite ALTER TABLE ограничен: поздние изменения схемы могут потребовать rebuild таблицы — планировать миграции с table-copy паттерном.",
    "Ложное ощущение «Postgres = безопасность для ПДн» без hardening VPS, TLS и секретов в env."
  ],
  "evidence": [
    "assumptions.yaml: team_size=1, hosting=один VPS, scale=автор+тестеры, data=ПДн, sqlite_pain=миграции/типы",
    "intake/answers.yaml: concurrency=«не сейчас, возможно скоро»",
    "BRIEF.md: success criteria — пороги «когда пора» и оценка стоимости перехода",
    "SQLite WAL: типичный потолок ~100k read/s и тысячи write/s на одном файле — далеко выше MVP-нагрузки",
    "Managed Postgres на том же VPS (docker) добавляет ~256–512 MB RAM и ещё один контейнер для мониторинга/рестарта"
  ],
  "questions_for_others": [
    "Security / cybersec: какой минимальный набор для ПДн на одном VPS — LUKS, off-site бэкапы, fail2ban — и меняется ли что-то при Postgres?",
    "Architect: «возможно скоро» по concurrency — это второй app-инстанс за 1–3 месяца или горизонт за 6+? От этого зависит, готовить Postgres сейчас или только абстракцию.",
    "Developer: текущий стек миграций и ORM? Если уже Drizzle/Prisma с dual-dialect — миграция тривиальна; если raw sqlite3 — нужен refactor до триггера.",
    "Lawyer: есть ли требования к residency/audit log, которые SQLite на одном VPS не закрывает?"
  ],
  "recommendation": "Остаться на SQLite для MVP. Немедленно: typed ORM + миграционный раннер, nightly off-site бэкап файла БД, DATABASE_URL в конфиге. Перейти на PostgreSQL при первом из триггеров: второй пишущий инстанс, multi-node deploy, или БД >10 ГБ. Подготовить docker-compose с Postgres в dev, чтобы migration path был проверен до прод-давления.",
  "research_requests": [],
  "invoke_optional_roles": []
}
