{
  "role": "developer",
  "position": "approve",
  "confidence": 0.88,
  "summary": "Для соло-MVP с нагрузкой «я + тестеры» на одном VPS SQLite — правильный выбор по умолчанию. Мелкие боли (миграции, типы) решаются инструментами и дисциплиной схемы; ПДн не требуют PostgreSQL как такового — нужны шифрование, контроль доступа и бэкапы на уровне приложения и хоста. Переход на Postgres имеет смысл по триггерам (конкурентная запись, несколько инстансов, реплики), а не заранее «на будущее».",
  "key_points": [
    "Операционная стоимость SQLite для соло ≈ 0: один файл, cron-бэкап, нет отдельного сервиса БД на VPS — это неделя сэкономленного времени против поднятия и сопровождения Postgres.",
    "Боли «миграции и типы» — инженерные, не архитектурные: Drizzle/Prisma/Knex (Node), Alembic/SQLAlchemy (Python), golang-migrate (Go), Rails migrations дают воспроизводимую схему; для SQLite достаточно включить WAL (`PRAGMA journal_mode=WAL`), foreign keys и единый путь миграций с первого коммита.",
    "ПДн не меняют выбор движка: и SQLite, и Postgres хранят байты на диске. Критичны TLS к приложению, хеширование паролей (argon2/bcrypt), минимизация полей, шифрование чувствительных колонок или тома (LUKS/SQLCipher при необходимости), ротация бэкапов и политика удаления — это одинаково нужно в обоих вариантах.",
    "Типичный solo-стек с ORM/миграциями позволяет сменить `DATABASE_URL` и прогнать миграции за 1–3 рабочих дня, если схема не использует SQLite-специфику (без тяжёлых `JSON`/`ARRAY` хаков без абстракции). Откладывать Postgres до триггеров дешевле, чем платить ops-сложностью с первого дня.",
    "Конкретные триггеры перехода: устойчиво >5–10 одновременных писателей или блокировки `database is locked`; второй инстанс приложения за балансировщиком; need for point-in-time recovery / read replica; рост команды, где нужны роли БД и аудит на уровне СУБД.",
    "На одном VPS Postgres добавляет: установку/обновления, tuning `shared_buffers`, мониторинг диска, отдельный процесс падений, миграции с даунтаймом — для соло это отвлекает от продукта без выигрыша при текущей нагрузке."
  ],
  "risks": [
    "SQLite на NFS/сетевом диске или без WAL — риск порчи файла; держать БД на локальном SSD VPS.",
    "«Database is locked» при росте конкурентности — симптом, что пора мигрировать; игнорирование ведёт к потерям запросов.",
    "Сырой SQL с SQLite-типами (INTEGER как BOOLEAN, динамическая типизация) усложнит перенос — нужна строгая схема и тест миграций на Postgres в CI хотя бы smoke-уровня.",
    "Бэкап одного файла прост, но restore без репликации = RPO до последнего snapshot; для ПДн нужен зашифрованный off-site бэкап и проверенный restore раз в квартал.",
    "Premature Postgres: трата 2–5 дней на DevOps вместо фич; managed Postgres (Supabase/Neon/RDS) снимает часть боли, но добавляет зависимость и счёт без текущей необходимости."
  ],
  "evidence": [
    "assumptions.yaml: team_size=1, hosting=один VPS, scale=автор+тестеры, sqlite_pain=мелкие неудобства",
    "intake/answers.yaml: data_sensitivity=персональные данные, concurrency=не сейчас, возможно скоро",
    "SQLite WAL mode: https://www.sqlite.org/wal.html — стандартная практика для веб-приложений с читателями и редкими писателями",
    "Оценка миграции solo с ORM: смена драйвера + прогон миграций + правка типов — типичный диапазон 1–3 дня при чистой схеме (инженерная эвристика, не бенчмарк)"
  ],
  "questions_for_others": [
    "Юрист: есть ли для целевой юрисдикции требования, которые технически невыполнимы на SQLite (например, обязательный audit log на уровне СУБД с неизменяемостью)?",
    "Кибербезопасность: достаточно ли LUKS + TLS + column-level encryption для ПДн на SQLite, или вы настаиваете на Postgres RLS/ролях с первого релиза?",
    "Архитектор: рекомендуете ли repository/DAO слой с абстракцией SQL с day one, или это преждевременная сложность для solo-MVP?",
    "Техлид: какой порог concurrent writers вы считаете жёстким сигналом к миграции — 5, 10 или при появлении второго инстанса?"
  ],
  "recommendation": "Остаться на SQLite для MVP. В week 1: включить WAL и foreign keys, завести миграции (один инструмент на стек), nightly encrypted backup файла БД off-site. В week 2: smoke-тест схемы на Postgres в CI (docker service) без переключения prod. Переход на Postgres — только при срабатывании триггера (database locked / второй инстанс / команда >1 разработчик с нуждой в DB-ролях), бюджет перехода заложить 2–3 дня solo."
}
